[
  {
    "carrera": "Arquitectura",
    "promotores": 1,
    "pasivos": 0,
    "detractores": 0,
    "score": 100.0
  },
  {
    "carrera": "Derecho",
    "promotores": 1,
    "pasivos": 0,
    "detractores": 0,
    "score": 100.0
  },
  {
    "carrera": "Psicología",
    "promotores": 1,
    "pasivos": 0,
    "detractores": 0,
    "score": 100.0
  }
]